publish_date,headline_text
20160727,wa govt to sign roe 8 contracts before election
20161018,police ombudsman disciplinary cases face long delays
20161123,nurses gave anaesthetic against guidelines at canberra hospital
20160819,39 beds closing at rah despite emergency department pressures
20160129,riverland house prices rise slightly
20160922,bulldogs want to be hated as they prepare for giants clash
20160216,nab posts quarterly profit update
20161116,nathan tinkler defends drayton south coal mine
20160703,rio 2016 michael phelps to chase fourth olympic gold in 100
20160707,aboriginal comedian karen edwards says laughter powerful
20160223,water taxis ferries gold coast 2018 commonwealth games
20160617,proceeds of queens birthday concert donated to flood relief
20160109,nba celebrating australia day thanks to glut of aussie players
20160516,life on the road with van cat meow
20161123,mayors seek mersey hospital funding certainty
20161124,makers of kinder surprise eggs investigating child labour claims
20160129,older australians now more likely to drive than gen y
20160728,rural passenger train travel westlander inlander subsidies
20160724,turkey detains senior gulen aide after coup attempt
20160807,greens idea to divert early years schooling money scotched
20161122,manly in brisbane hosts raceboarding world championships
20160823,health ombudsman worried sex assaults by masseurs unreported
20160712,luke simpkins concedes defeat cowan anne aly
20160414,westpac set to exit nauru
20161027,ceos message to the dorsett family
20161109,heritage minister throws esperance tanker jetty lifeline
20160118,chiropractic board of australia under investigation
20160229,man who abducted 1yo from foster care sentenced to jail
20160602,justin trudeau raises rainbow flag
20161203,melbourne man charged with murdering french tourist
20161220,drug trafficker re sentenced to jail after home detention appeal
20160314,turkey suicide car bomb kills dozens in central ankara
20160211,iron boy
20160622,disruptive works to begin on metro rail tunnel in 2017
20160317,kimberley fish kill mystery fisheries department says
20160520,rio 2016 kyle chalmers holds afl dreams despite olympic berth
20160324,lawyers criticise high court challenge to new senate voting laws
20160107,victorias tourism logo too big for court at australian open
20160725,joan ryther accused killer michael burke not guilty rape murder
20160811,italian mp exasperated sexist cartoon
20160203,nsw accountant facing fraud charges
20161118,man jailed 10 years more than 2500 kgs cannabis trafficking
20160613,allianz forced to reimburse petplan customers
20160427,arthur sinodinos says no to senate committee appearance
20160217,medical condition led to driver being six times over limit court
20161013,australian share market dips
20160804,cost of living newstart student nijole naujokas
20160805,stem cell clinics exploiting regulatory loop holes
20160921,mccains imports workers as dispute worsens
20160512,border control stopping people from joining terror groups
20160622,danny lyon americas outlaw photographer
20160127,djokovic sets up federer semis date at australian
20160208,pentland arts and crafts
20161206,sex and ageing older people tell us what they really think
20160928,footage shows alleged tornado blyth sa storm
20160109,classic toys may be a better investment than shares
20160731,man charged over indecent assault of woman in mandurah hotel
20161006,titans cocaine supplier john touma katmichael hunt stand trial
20161115,what we can learn about architecture from burglars
20161211,ali zafar wahidi dux academic prizes
20160301,hewitt shrugs off kyrgios fitness concerns ahead of davis cup
20160603,singer songwriter graham nash on happiness and harmony
20160923,fit and firing jackson bird pushing for australian selection
20161023,golf on the hunt for new members after tough times
20160315,youth unemployment hotspots persist in regional rural australia
20160914,former cfmeu official agreed to give evidence against union
20160121,abba reunites for opening of mamma mia venue tyrol in stockholm
20160823,east gippsland cuddle cot tara lea
20161104,adelaide bushwalkers enlisted to help koala research
20160115,two vehicles get stuck in crocodile waters at cahills crossing
20161219,a nsw man says without state care he'd be in jail
20160130,netherlands to join bombing of islamic state targets in syria
20161130,steve smith welcomes odi return of pat cummins
20160315,bondi hair salon helping op shop in nt community jilkminggan
20161222,farmer greg kenney finedl for refusing to leave salmon gums land
20160715,porte calls for action on tour fans after crash chaos
20160317,bunbury baby death dcp missed warning signs
20160920,youtube portraits explores 19th century australian women
20160213,sydney fc perth glory report
20160218,no exams lectures or nerds in the tower csu engineering
20161125,hero tradies come to aid of springvale bank fire victims
20160706,barnes chookyard politics prevailed at this election
20160803,university of tasmania mourns holds hope for missing fishermen
20160113,victorians warned to heed extreme heat warnings bushfires
20160413,nsw prisoners brew more than 8000 litres of alcohol
20160518,pink diamond sells for record $42.8 million at
20160322,man in his 90s left waiting two days for surgery after fall
20160202,jobs secured as hunter valley mine expansion approved
20160421,former wa government minister gordon hill firepower fraud
20160321,regional baby boomers are in the crosshairs of bowel cancer
20161207,melbourne man attempts world record for longest chistmas day
20161205,italian prime minister matteo renzi to resign after referendum
20160411,death toll from south asian quake rises to six officials say
20160128,pearce stood down from roosters for unacceptable
20161217,santa claus preparing for christmas at finland home
20161122,child death rates improve but 23 could have lived with vaccine
20160806,heckenberge shooting; young man recovering in hospital
20160416,turnbull returns from first visit to china
20160621,more floods forecast for parts of tasmania
20160321,whitsundays deputy mayor takes lead in election vote count
20160928,tasmania prepares for wild weather
20161226,melbourne heat to ease bom new years eve boxing day test
20161206,aussies win chappell hadlee trophy 2 0 with 116 run win over nz
20160309,australian islamic leaders son killed in syrian conflict zone
20160315,myanmar elects htin kyaw as first civilian leader in decades
20160920,bulldogs members buy more tickets than giants fans for afl final
20160911,study uses incentives for women who quit smoking during pregnan
20160811,market close asx finishes lower
20160801,vcr a final farewell
20160229,shaun kenny dowall cleared of domestic violence charges
20160411,farm animals believed abandoned fremantle primary school
20161223,women on track recruitment drive boosts number of women work
20160922,bali police investigate possible terrorism link ammonium nitrate
20161012,two injured light plane crash in south grafton
20160616,auditor general questions light rail cost benefit claims
20160110,power boats destroyed by fire on nsw mid north coast
20161025,bali nine myuran sukumaran exhibition self portraits from final
20161224,family of 20yo brings first suit in california warehouse fire
20161117,neil de graff remembered by friend following death
20161017,woman in custody for starving chihuahua in adelaide
20161108,former tennis star david nalbandian flips rally car in crash
20160321,swan hill trainer wins outback cup at st pats races
20161117,asylum seekers will not exploit australia us resettlement deal
20161009,person killed in car crash in canberra's inner north
20160712,at least 22 dead in italy train crash
20160727,kevin rudds bid to be un boss set for cabinet consideration
20160725,ex soldiers; inmates and thoroughbreds helped by jail horses
20160221,fears warming climate could see fruit fly establish in tasmania
20160808,japanese emperor addresses nation
20161102,adele reveals postnatal depression fight
20160406,naked knife weilding woman tasered in bunbury
20160904,tromp family speak after father found
20160522,jarryd hayne still adjusting to new code after london sevens
20161013,a big country big hopes from small garden
20160809,aussies through to rio womens rugby final
20160714,boris johnson foreign secretary history of undiplomatic gaffes
20160516,nick di girolamo sues fairfax media over smh articles
20161224,police probe gang drug links in gutless fatal shooting
20161025,james pattinson rules out test return for australia south africa
20161209,australias energy policy cant meet current targets
20160318,detectives confirm missing grafton teacher last
20160520,dressmaker author rosalie ham
20160401,party time at the lodge
20160212,excessive force used by israeli soldiers against palestinians
20161110,wa premier raises election concerns in wake of trump victory
20160711,euro 2016 eiffel tower fan zone tear gas water cannon
20160811,deputy chief minister delivers valedictory speech to assembly
20161223,thai police rescue two baby orangutans
20160906,samsung recalls galaxy note7 smartphones over explosion risk
20160208,nsw should focus on renewable energy sources not csg
20160819,australian dollar drops local shares ride profit
20160405,women on a mission veterans to trek kokoda and raise awareness
20161006,australia hunted down by south africa in sensational odi chase
20160723,solar plant to store power in shipping container sized batteries
20160621,schools hospitals not addressed in nsw budget opposition says
20160125,the cassettes dance troupe bring 1980s daggy moves back
20160614,snowboarder skier jailed over snow season drug ring
20161212,brighton human remains identified as wayne youngkin
20161109,victoria police stolen tools melbourne trades
20160710,maroons dane gagai nate myles cleared state of origin iii
20160727,miff to feature virtual reality events
20160721,1965 indonesian mass killings were crimes against humanity
20160616,lone hacker claims responsibility for cyber attack on democrats
20161108,first female us attorney general janet reno dies age 78
20161129,arl commissioners back chairman grant in standoff with clubs
20160418,indonesia breaks silence on 1965 massacre
20160430,shooter on the run as police investigate bankstown shooting
20160414,men on stolen moped snatch bag from womans arm gold coast
20160413,tracked bittern robbie goes missing in action
20160304,turkish court jails two syrians over drowning of toddler
20160719,michael j fox goes back to back to the future with coldplay
20161021,i wasnt really sure if hillary was going to be
20160212,kingsbury doing right by east timor should be bipartisan policy
20161111,grumpy goat attacks elderly man on qld gold coast
20160617,sisters of the world a place for multicultural women
20160911,sydney swans to be without kurt tippett and callum mills
20160310,paid trips to space likely in 2018; blue origin boss says
20160422,shortform music icon prince dead at 57
20161021,four years that will shape bendigos future
20160201,perth ferry services face first test since elizabeth quay move
20160923,wa court lists waiting times blow out
20160504,radiohead turns to stop motion animation to release new song
20161226,uluru closed homes damaged by flashfloods in central australia
20161003,questions over need for mandatory assault sentences
20161016,drones to hunt and destroy mosquito populations
20160829,prisoner released for the day to help team win grand final
20161025,business leaders say immigration changes threaten uk economy
20161114,the drum monday november 11
20160720,launceston businesses label petrol price unfair burden
20160221,us commander defends joint strike fighter f 35a
20160122,adelaide wakes up to 90 per cent humidity
20161015,assad says taking aleppo from rebels key to defeating terrorists
20160711,asx australian shares surge on us jobs bounce
20160201,inflation picking up on rising import costs
20160909,iconic rsl building latest addition to wa heritage register
20160520,telstra's 243 billion nbn blackhole puts dividends under pre
20160518,cat owners more concerned about pet welfare wildlife risk
20161003,png calls on international community for help with
20160904,how to become a saint like mother teresa
20160615,share market closes 1pc lower amid brexit fears
20161027,sydney doctor accused of murder did not know how his wife died
20161005,piano maker creates museum to preserve golden era instruments
20161013,best books to make you feel better
20160409,kelly slater shown the door by leo fioravanti at margaret river
20160512,new councils created under forced mergers across nsw
20160108,medical risks connected with space travel researched
20160808,high risk fugitive surrenders days after shots fired by police
20160217,stolen war memorial plaques endangered turtles seized
20160615,packers crown to split australian casinos from overseas assets
20160415,fisheries managers accused of secrecy over factory trawlers
20161204,how climate change is affecting the wine we drink
20161011,canberra radio host apparently attacked after dressing as clown
20160603,teenage rooftop prankster spared conviction
20160906,burning man festival white ocean attacked
20161201,question time protesters should be punished mp matt canavan
20160804,jump! jump! jump! leave your bags behind:
20161028,revenge porn sexting penalties boosted in sa
20160429,school of ants at woodfordia
20160323,residents launch class action over williamtown contamination
20160414,adelaide metro beaches a polluted casualty of festive season
20160304,man who attacked 82yo canberra man sentenced to jail
20160112,hunter storms leads to suspected 'blackwater' and fish kill
20160530,cindy waldron feared dead in croc attack daintree far north qld
20160502,house prices jump in april
20160902,commsec to pay penalty 1.1 million in refunds
20160909,australia's poor face escalating hunger problem
20160810,michelle payne loses ride on prince of penzance at caulfield
20160424,man found stabbed to death in hobart house
20160615,desperate gazans struggle to seek urgent medical help in egypt
20160608,labor also pledges to upgrade barton highway
20160517,the drum tuesday may 17
20160212,australian laws failing to change culture of gender inequlity
20160204,us demands russia stop syria bombing after talks suspended
20160121,pakistan university attack expose taliban divisions bacha khan
20160615,pestatarian feral meat diet sustainable step says researcher
20161115,mosul partly liberated from islamic state by iraqi forces
20160316,lisa scaffidi travel expense scandal probe highest priority
20160120,targa tasmania inquest findings breath testing speed limits
20160310,sri lankan girl reunited with family after visa granted
20160118,emergency warning for bushfire at crib point south of melbourne
20160608,footage of shots being fired in port moresby
20160927,the nbn bill shock for small telcos
20160909,turkey suspends thousands teachers allege kurdish militant links
20160720,woollahra council loses legal challenge over forced amalgamation
20160714,la trobe university writing course immerses students in festival
20160926,fears missing karratha fisherman norman bale did not have epirb
20160810,controversial facebook page blokes advice shut down
20161109,senate looks for compromise on refugee legislation
20160804,health report paints poor picture in queenslands wide bay
20161022,ex policeman ron fenton calls for end to worksafe bonuses
20161123,decision to send youth rioters to adult prison to be challenged
20161019,english raider qewy wins geelong cup
20160621,tropical birds found on sub antarctic macquarie island
20160329,minecraft history lessons a hit with rockhampton students
20160216,lee the lockout law review mustnt be so close minded
20160224,swan hill students combining technology and culture to give new
20161228,australian share market sees lift
20160713,consumer confidence falls on brexit election
20160203,neymar accused of brazil tax evasion
20160603,us shares post modest gains ahead of non farm payrolls
20160725,sport quiz july 25
20161129,politics live november 29
20160816,france defends burkini ban
20161129,queenscliff shark attack fisherman serious hand injuries
20160827,lachie smart youngest person circumnavigate globe
20161011,murray darling basin effects of water buyback on nsw communities
20160520,jarryd hayne named in fiji london rugby sevens squad
20161229,imran khan mulls joining a grand alliance of
20160720,dress designer johanna johnsons personal assets quarantined
20161020,us election angela davis warns trump paving way for fascism
20160912,ceduna cashless welfare card massive inconvenience
20160218,sunshine coast professional mariachi musician
20160224,nsw opposition says burton brothers given contracts despite debt
20160822,ibac ends ballarat council staff investigation
20160502,wires saving coffs shearwaters
20161108,graffiti in regional areas
20161103,man charged with van phan nguyen stabbing murder in 1989
20161110,kids at risk abseiling
20160922,man found on road in critical condition at springvale south
20160530,17yo accused of setting fire to ex girlfriend appears in court
20160506,hunting history in highland tasmania
20160805,alleged ivanhoe jail escapees discovered hiding in warrawong
20160303,inmate refuses deal over alleged escape bid from prison
20160623,cheika plays peacemaker at fiery wallabies press conference
20160817,black market weapons thieves channel guns to bikies
20160826,legal win for tarkine group opposing mines
20161009,former wa sheep station becomes conservation reserve
20160122,bipolar treatment revolution lithium
20160112,maccallum every reason to simply keep the course steady
20160824,catherine skinner welcomed home
20160911,penrith panthers dominate canterbury bulldogs move into nrl semi
20161001,russia consolidating grip on crimea war on europes doorstep
20160607,the book that peter started and dyane finished
20160720,mother jailed on drug offences appeals claiming kids will suffer
20160916,duterte drug war overkill creating crisis in philippines
20160425,thousands attend anzac day dawn services across australia
20160519,is duttons rhetoric comparable to trumps
20161217,mick jagger names eighth child deveraux octavian basil
20160302,sas housing review at campbell barracks in wa could take months
20160721,take a trip around the virtual world and beyond
20160525,heritage bank warns alp over similar slogan people first
20160706,flooding along yangtze river forces millions to evacuate
20160207,sa improves preschool child to teacher ratios
20160722,hollywood director justin lin
20161007,fiery high speed crash in adelaide woman dead teens charged
20160521,melbourne childrens take on colouring book craze
20160817,two south australians receive bravery medals
20160331,christian brothers deny dodging sex abuse compensation
20160120,jakarta attack survivor tells of horror
20160729,act police lose dozens of items
20160115,brothel madam wants licensing system for wa sex workers
20160830,share house sets young aboriginal meatworker on path to china
20160831,section 18c too broad and too vague and should be repealed
20160815,magistrate jails woman over centrelink fraud
20160726,brother of one punch victim thomas kelly dies
20160323,noarlunga patient gets jail time over hospital murder
20160122,venus flytrap plants can count to five
20160902,prisoner released early at large for months before detection
20160404,donald trump announces recession surprises economists
20160710,election 2016 coalition frontbenchers confident of winning
20160624,man who posed as police refused bail child pornography charges
20161228,2016 sydney to hobart yacht race
20160325,minister fiona richardson reveals history of family violence
20160928,social media reacts to sa blackout
20160211,lauren jackson to retire from wnbl but not opals:
20160916,tiger prawns brood stock
20160507,calls for reform of thai remand system after abuse of prisoner
20161125,dog attack court appearance
20161215,dollar tumbles after us interest rates increase
20160411,beattie: clive would love to have been prime
20160225,briggs four reasons why we need to invest in submarines
20160104,interview with dr abbas kadhim
20160202,adam giles softens stance against gst increase
20160106,rainfall provides little relief for western nsw landholders
20160127,curson is zika virus our next global health crisis
20160129,thailand draft constitution unveiled
20160119,professor james curran on malcolm turnbulls us
20160522,wa communities grow impatient over lack of drinking water
20161021,fashion's indigenous heritage
20160512,will clive palmer run for a senate seat
20160104,strange light above canberra probably ball lightning
20160208,perenjori rubbish bins painted community project
20160723,russia expected at rio 2016 in some form
20160530,mcewen candidates urged to pledge sports ovals funding
20160820,tanker refloated after running aground off victoria's coast
20160907,albany premier hotel arson attack accused men appear in court
20161128,perth urban sprawl causing transport and jobs woes
20161127,seven dead one missing in fishing boat accident near auckland
20161001,californias rape laws widened after stanford university case
20160818,german twins holding hands in rio race criticised by spectators
20160405,canberra dragon boat club wins at world championships
20160617,insiders barrie cassidy wraps up week six of the
20160802,barnett denies leadership under challenge at party meet
20160607,supreme court dismisses eels officials proceedings
20160914,five time champion evan o'hanlon retires after
20160920,level crossing train station upgrades victoria port of melbourne
20160612,residents stressed over roofless building setback
20161103,australia takes the spoils on day one of sa series
20160520,thailand long and funny coup
20160314,the death of australias big things
20160809,hobart man crafting stringed instruments from cigar cheese boxes
20160511,brothel licensing scheme rejected by nsw government
20160113,sydney hangover clinic could encourage binge drinking ama fears
20160326,wheelie bin thrown from overpass smashes car windscreen
20160831,sam dastyari charity returns donation
20161005,mother sues school after son dies from snake bite on excursion
20160624,tasmania weather snow expected in hobart flood watch rivers
20160112,essendon supplements peter jess players must sue
20160628,pac approval of barangaroo crown casino development
20160609,housing groups get government homes to build new homes
20160502,adam voges in hospital after hit in head by cricket ball
20160223,convicted doctor fears deportation to sri lanka
20160630,league of legends queenslander avoids jail over sale user data
20160808,online pirates ripping off australian designs from instagram
20161128,hobart siege ends after man surrenders
20160906,long term bans handed down after digicel cup
20160125,beach goers urged heed warnings surf life savers australia day
20160819,body shaming what not to do
20160920,pacific nations look to tokyo to build on rio
20160708,tasmanian greyhound trainers claim state free of cruel practices
20161111,mitchell dismisses brownlow speculation west coast debut
20160915,questions raised over mine rehabilitation security deposits
20160929,sa weather fuel shortages eyre peninsula residents stranded
20161121,penola road accident sparks poignant social media campaign
20161219,tinder in tasmania how do people use it in a small city
20160722,transport ministers confirm search mh370 to be suspended
20161128,wa plant library records 50 new wildflowers every year
20160307,ex president of nauru slams visa changes
20160521,hot air balloon offloads passengers in port
20160817,queensland magistrates book raises issues around youth crime
20161107,fears aussies being targeted by gangs in war ravaged countries
20160924,shopping hours
20160721,north korea restarts coded spy broadcasts south says
20160222,parents of trangender children meet with politicians in canberra
20160605,employees reinvent themselves in victorias manufacturing base
20161108,bank earnings fall for first time since financial crisis
20160815,top nsw police to front sydney siege inquest
20160301,stereosonic organisers endorse pill testing at their events
20160728,darcy vescio carlton female footballer
20160903,brisbane exhibition displays artworks by refugees
20160107,building approvals boom could be over
20161216,headspace only small benefit for youth mental health
20160404,cannonvale shopping centre shops destroyed in fire
20160502,manus island asylum seekers could get compensation lawyer says
20160315,wall st closes flat as investors await fed meeting
20161220,riverland christmas tree farm keeping tradition alive
20160419,plans unveiled for new bridgewater bridge
20161216,queensland boxing inquiry head frustrated after
20161219,sydney to hobart quiz
20160408,last link to iconic gillies pie brand shuts its bendigo doors
20160607,australia south africa odi a pink ball precursor
20161220,assassin was member of turkeys riot police;
20160210,no regrets for popular boulder publicans selling up
20160929,online coach bridges tyranny distance regional qld bodybuilder
20160615,clive palmer sells a tax free tasmania
20160201,man who allegedly spat blood in womans face pleads not guilty
20160602,proposed apartment precinct prompts concerns in heritage city
20161125,australia v south africa third test adelaide oval day two live
