publish_date,headline_text
20160328,belgium charges three with terrorist activities
20160621,mother bear killed after attacking marathon runner in new mexico
20161227,five men dead in horror nsw christmas drownings
20160601,cold case of kwementyaye nelson hit run being investigated
20160607,warrnambool saleyards tipped to close within five years
20160315,horsham nutbush breaks world record
20161214,craft a small part of weekly group for migrants in launceston
20160506,colac courthouse to get security upgrade
20160211,islamic college of brisbane forced to overhaul management audit
20160715,socialite lady susan renouf dies at 74
20160108,firefighters battle to control mt roland fire caravan burnt
20161006,aba ceo steven muchenberg discusses the banking
20160725,why termites are good for birds wildlife ecology
20160519,egyptair flight disappears from radar with 66 people on board
20160322,telco shares lead gains on on slow day of trade
20161130,commodities get smashed on chinese futures markets
20160515,mining downturn healthcare major issues for marginal hunter seat
20161004,fake immigration scam costs new australians
20160131,severe weather lashes australia
20160326,microsoft apologises for offensive tirade by its chatbot
20161028,frequently asked questions north coast shark net trials
20161121,susan neill fraser wants judge removed from appeal
20160808,travis head joins sri lanka tour australian selectors nervous
20161101,australia south africa temba bavuma not worried about bouncers
20160622,dutton turnbull confirm vietnam asylum seeker boat turn back
20161117,nsw biodiversity laws get mixed reaction
20160517,thieves steal 25 000 vase and fathers ashes
20160520,pefo forecasts unchanged from budget
20160704,nasas juno spacecraft poised for one shot try to orbit jupiter
20161214,loss of loved ones strengthens resolve of new act politicians
20161206,china urges us to block transit by taiwan president
20161220,latrobe valley representation post hazelwood
20160814,rspca to probe possible hunter valley greyhound burial site
20160401,north korea fires another missile south korea says
20160926,foster care not in crisis says minister amid review warning
20160705,services index shows modest growth continues
20160922,university of adelaide unveils aspirational masterplan
20160424,people warned not to use drones at anzac day events
20161205,trump names former rival ben carson as housing secretary
20161101,cath burn holds on to counter terrorism job in nsw shake up
20160727,chief minister frightened of lockout law backlash
20160609,guilty pleas over groote eylandt island riot
20160412,nt aboriginal school yirara college child sex abuse inquiry
20160703,aged indigenous population to nearly double
20160520,franklin leads swans to wire to wire win over hawks
20160303,west coast eagles beat gold coast suns in afl preseason challen
20160301,central highlands mayor peter maguire retires
20160601,thai singer tom dundee jailed for offending monarchy
20160624,nt four weeks of school holidays activities children
20161219,should we care if australias credit rating is downgraded
20160726,gippsland jenny mcconnell
20160829,neill wagner fined landing helicopter brisbane downey park
20160826,fiji sports commission presses ahead with 4 year
20160301,ghost town a window into was past
20160727,mothers of the movement take the stage at democrat convention
20160408,brisbane cross river rail needs innovative funding jackie trad
20160601,home prices surge back to double digit gains
20161206,adani claim for government loan questioned after admission
20160506,ex sanitation worker guilty of la grim sleeper murders
20161215,asic wheat board executives sanctions iraq breach
20160701,chief scientist dr alan finkel named victorian of the year
20161125,kelly odwyer anthony albanese negative gearing
20160220,shark attack suspected missing diver equipment found
20160208,cambodian kids die hitting discarded rocket with an axe
20160719,paralympic rowers determined to win
20160902,bradbery to run as independent candidate in wollongong
20160523,good guys set for ipo or sale
20160524,louis van gaal bizarre moments as manchester united boss
20160713,black lung nearly 20 potential cases identified queensland
20161128,pearson abuse claims straining relations with qld government
20161116,obama warns of rise in crude nationalism
20160912,interview: david lipson; political correspondent
20160208,security guard shot at nepean hospital safety meeting held
20161019,queensland on track to retain aaa credit rating says curtis pitt
20160105,man steals petrol leads police on chase before crashing moruya
20161021,friday markets with julia lee
20161201,carbon auctions deliver funds to beef cattle producers
20160912,abc live politics blog september 12
20160617,spider crabs orange chaos of legs and claws reach australia
20160602,united patriots front misses federal election deadline
20160426,asc shipbuilders vindicated by government decision
20161129,correcting apostrophe use in the internet age
20161017,jameka receives 1.5kg melbourne cup penalty
20160704,state of origin iii gavin cooper queensland maroons team
20160503,ambulance operators call for public to stop being aggressive
20160906,black lung 54yo man confirmed as 15th case qld since 2015
20160216,24 million and counting
20160426,sydney mural of prince sparks tributes from fans
20161229,stocks make end of year recovery
20160617,a look back at week six of the election campaign
20160623,man puts baby in fridge after leaving her in hot car
20160813,rabbitohs steamroll warriors 41 22 in auckland
20160317,evocca college sacks 220 staff set to close campuses
20160728,queensland government powerless to act against tyre stockpile
20161014,oliver loses appeal against reckless riding ban
20160623,bill shorten speaks on 730 ahead of election
20160831,live politics blog august 31
20161229,murchison meteorite
20160317,indigenous leaders call for health equality close the gap day
20161009,severe wind gusts lash south australia in storm wake
20160826,bootu creek manganese mine creditors hq advisory
20160205,girl loses part of her nose in sydney dog attack
20160421,olympic torch lit rio 2016 games
20160704,naidoc week possum cloaks key to cultural revival
20160219,katay in defence of the archbishop
20161027,melaleuca explore tasmanias enchanting southwest national park
20160511,new zealand warns hikers away from lord of the rings volccano
20161214,sydney weather heat december record bondi beach penrith
20161229,police confident theyve dismantled drug ring
20160716,grey nomads stuck in the mud at middleton pub western qld
20160326,suicide bombings hit yemen
20160526,people evacuated after fire breaks out in hospital precinct
20160504,what does ted cruzs exit mean for the republican
20160720,turkey suspends thousands of public servants failed coup
20160324,portland wind tower maker backs saving of arena; cefc
20160617,chinese tourists forecast to spend more than 4.1 bn
20160302,gdp economic growth data december quarter 2015
20160503,crabb guru morrison and the budget thats totally a plan
20160421,anzac day 2016 your guide to brisbane dawn service and parade
20160506,germany asylum seekers merkel moves to integrate new arrivals
20160512,british barbarians need manners lesson says china press
20161017,property market value to drop
20160304,osbornes declared bankrupt after legal stoush with foxy robinson
20161213,wa labor leader mark mcgowan deflects liberals' campaign
20161223,man arrested after multiple attempts to blow up atms
20160705,water campaigners happy to work with re elected nationals mp
20160702,dhaka shooting siege cafe cleared
20160317,luxury perth apartments queens riverside wa housing authority
20160523,arrium steelmaker to be put on the market
20160930,police set up crime scene at home of missing woman debra barbu
20160516,dams continue to fill in tasmania after weeks of wet weather
20160226,strahan water contamination boil alerts expected a week
20160801,rio not ready with just days to go
20160712,coal still king despite renewable energy growth
20160708,gerard baden clay dpp files final documents in appeal case
20160615,who says low risk of zika virus spread at rio 2016 olympics
20160311,perito moreno glacier ice bridge collapses in argentina
20160302,nine people suffer heat exhaustion at sydney sports event
20160809,australians miss out on medals in the pool
20160302,fears aired over impact of tafe cuts on regional wa
20161031,manmeet alisher death independent investigation ordered
20160729,first 24 hour sexual assault response unit set up in qld
20161208,stop violence and give your family the best gift of all
20160620,the drum monday june 20
20160211,grandmothers against removal rally
20161111,australian family fleurbaix sign turns out to be rare trench art
20160726,queensland curriculum program to change
20160604,rio police investigate report of body at sea in search rye hunt
20160702,new taliban leader tells united states to end afghan occupation
20160528,curious campaign how does the abc weigh coverage in elections
20161118,social media to play big role in wa election
20160317,ccc wont investigate whitsunday deputy mayor andrew willcox
20161221,christmas food favourites and what they will cost you
20160806,giants overcome gallant suns be eight points
20160323,new government health advice on chemical exposure finds no valu
20160308,suicide survivors key to curbing suicide rates
20161201,nhulunbuy mla guyula to stay in nt parliament
20161117,maroon kit wont inspire brisbane roar a league
20161025,stephen herczegs son angry over death he says at inquest
20161010,greyhound trainer charged with live baiting in sydney
20160816,meat futures
20160321,water pipe maintenance defended after more bursts in adelaide
20160421,australian exhibition from venice biennale goes on display
20160611,cold front brings snow to tasmania after floods
20160107,government raises hoverboard safety concerns
20161205,government rejects basslink's 'no cause' finding on cable fault
20160225,campaigners welcome progress medicinal cannabis legalisation
20160212,steketee our politics have changed and not for the better
20160405,nsw government releases further details of new light rail
20160325,woman and child found dead in sydneys east
20160324,unnoticed death of reclusive neighbour raises questions
20160115,wheelchair basketball juniors up to challenge at sunshine coast
20161206,ten years on from the bainimarama led fiji
20160930,vet found guilty over hendra case
20160916,kalgoorlie police on house fire and tension after riots
20160105,berg the alternative to ubers surge pricing isnt fair either
20160623,brexit parisians woo britons to stay with operation croissant
20160214,nsw labor conference party will publicly announce donations
20160629,abetz defends ad accusing lambie of cuddling up to greens
20160619,big brother lebron james says simmons has all the tools
20160514,tea tree plaza cafe giving hope to disadvantages youth
20160602,canberra teenagers ice addiction treated with success
20160701,sentencing submissions for woman accused of dubbo murder
20161206,darren ashley eaten up by inability to exert control court hears
20160428,wests tigers snap losing streak with 30 22 win over south sydney
20160519,monaro council merger fight federal election
20161104,poll: if you could vote in the us election would
20161108,massimo botturas fight against food waste in new doco
20160420,manjimup shire translates wa road rules for foreign drivers
20160623,mans body found in port river identified
20160701,mactiernan backs opposition to kwinana buffer extension
20160505,trump says cruz; kasich and rubio all potentials vps
20160414,target to shut geelong headquarters cut hundreds jobs
20160101,w league finals race
20160604,rio police investigate report of body at sea in search rye hunt
20161011,ice use becoming intergenerational in indigenous communities
20160927,the drum tuesday september 27
20160411,farm animals believed abandoned fremantle primary school
20160507,johnston listed in vulnerable sixth spot on wa senate ticket
20160421,anzac day commemorations students brisbane anzac square
20160520,australias bmx riders are looking for redemption in rio
20160605,malcolm turnbull is he fond of beards
20161221,russells black bat in bbl opener banned by ca
20161019,kenyan macadamia farmer turns to australian expertise
20161017,murder conviction court of criminal appeal
20160718,australian survivor returns to scene of nice attack
20160430,russia defends intercept of us plane over baltic sea
20160314,boy shot with air rifle step father charged cairns
20161104,cyber attack threats expose australia to $16
20160602,cyber criminals are stealing identities via veda advantage
20161012,matthew leveson michael atkins loses appeal coroners inquest
20161018,accc accepts cbh undertaking
20161211,mona waterfront vision to take three decades
20160603,captains pick: are the politicians playing it too
20161108,thousands sign petition to save pet pig in mount isa
20160720,anu college students expelled over alleged sexual harassment
20160815,australia china economic relationship set for
20160202,adam giles softens stance against gst increase
20161213,proposal to restrict distribution of how to vote cards
20160513,meningococcal cases rise prompting health warning
20160701,theresa may makes bid for pm
20161103,hazelwood where should the millions be spent post closure
20160824,national press club: bill shorten
20160904,storm hermine expected to return to hurricane force
20160101,bob hawke discusses release of cabinet papers
20160601,super changes will not just affect wealthy: ipa
20160131,more syrians starve to death in madaya msf
20160228,bernard tomic falls short in acapulco final
20160720,bhp billiton iron ore production falls on samarco
20161030,mexico city celebrates first day of the dead parade
20160224,asian champions league melbourne victory downs shanghai sipg
20160925,arsenal thrash chelsea as united win without rooney
20160202,why australias tour of new zealand will be better
20161119,dead fox find raises biosecurity concerns
20161007,farmer shares stories of living through the nsw flood
20161020,illegal tobacco chop chop crackdown
20160825,wa farmers federation rejects rspca inquiry
20161005,rsl to get new perth hq as anzac house faces wrecking ball
20160507,locals reject wallerberdina nuclear dump at hawker meeting
20160708,womens sporting clubs should ask the government for funding
20160509,development approved for melbourne convention centre site
20160725,man charged with north hobart murder appears in court again
20160519,youth plea on sarah paino mansalughter case
20161011,grandstand commentatorjim maxwell continues recovery from stroke
20160215,marie berry calls for greater diversity in british
20160307,ses help rescue stranded campters waterpark creek central qld
20160815,nanny pilot program ignores isolated children
20161027,federal government rejects medicare levy domestic violence
20160411,man hospitalised after incident at florence falls nt
20161103,darwin night patrol under threat of closure by december
20160229,nbn co confident of meeting targets; despite setbacks
20161011,ofc champions league awards hosting rights to
20160323,sex offenders crackdown a start but call for harsher penalties
20161108,new roadside breakdown service app stuck
20160325,brisbane to gladstone yacht race
20161010,parliamentary inquiry demanded as gas tax leaks
20161004,plea to help farmers deal with flood aftermath
20160329,banks tank as bad debt and global fears mount
20160412,cervical cancer screening rates among indigenous women low
20160909,police chaplain says delivering bad news weighs heavy
20160127,pair pleads not guilty after satudarah bikie crackdown in sydney
20160831,hurricane madeline heads toward hawaii
20161027,ceos message to the dorsett family
20160601,karl marx affair focus of bendigo play
20160407,szoke panama papers and the inadequacy of our tax laws
20161123,the changing face of india on the move
20160528,rio 2016 olympics should move due to zika virus threat
20160901,do we need to reform our political donation system
20160204,brisbane archbishop denies he was responsible for youths abuse
20160413,tracked bittern robbie goes missing in action
20160713,do police dismiss aboriginal women experiencing
20160923,handmade wooden cradle offers insight into launceston prison
20160224,danny klobucar murder trial begins
20160109,malcolm turnbull to meet with barack obama on january 19
20161111,new laws for contracts between big and small
20161216,debates revisited on free range egg standards
20161111,worlds largest shopping frenzy to begin in china
20160726,driver blamed for freight train derailment colebrook 2014
20161208,woman accused of trying to drug men lighting ballajura fire
20161207,trump's taiwan call 'a signal' that geopolitics
20160106,second drive by shooting at south melbourne strippers
20160729,nalder says no need to change leader at this point
20161012,dog breeders angry over new victorian laws
20160331,lionel messi sparks outrage in egypt after donating boots
20160910,bangladesh tongi factory fire
20160210,comedian julian clary; down under for the adelaide
20160406,nathaniel rateliff on faith; work and music
20160318,drink driver jailed over cyclist crash in mildura
20160421,former wa government minister gordon hill firepower fraud
20161223,reports of colonel potters death are greatly regurgitated
20160617,chinese tourists forecast to spend more than 4.1 bn
20160929,victoria weather system from south australia lingers over state
20160314,two men arrested over car jackings may have gang link police say
20160913,kye ryan brain surgery proton therapy treatment in us
20160711,fewer assaults reported liquor laws qps
20160309,celebrating life through song as bundaberg honours director
20160310,penrith panthers canterbury bulldogs nrl
20160614,tony archer controversial canterbury bulldogs try decision
20160119,antenna repairman charged indecent assault woman in shower
20160210,barron us elections: does new hampshire matter
20160928,farewell to tangles as max walker dies at 68
20160127,crystal palace signs emmanuel adebayor
20160905,jae criddle abc news elise fantin
20160926,nga granted 11m compensation for stolen dancing shiva
20160811,scott morrison sale of ausgrid to chinese consortium blocked
20160519,new technology plan cycling infrastructure upgrades map trends
20160412,parkinsons disease symptoms helped by sleep uni wa study finds
20160625,call to release travel expenses of utas vice chancellor
20161024,woman loses bid for ongoing compensation after 26 years
20160224,tafe overhaul may lead to course rationalisation
20160809,australians miss out on medals in the pool
20160502,adelaide united fans celebrate a league win
20160614,cleric set to leave australia after anti gay comment controversy
20160208,graffiti attacks costing thousands for mid north coast council
20160920,horses ride through london for annual blessing celebrations
20161024,expectations on welfare recipients miserably low
20161205,indigenous graduate sets up high school achievement award
20160601,state of origin robbie farah laurie daley furious at referees
20160401,major industry unlikely to be left in lurch over energy crisis
20160429,julia creek residents forced to travel to cloncurry for flu shot
20160129,scenic rim council approves new quarry
20161017,inner city apartment prices predicted to tumble 15
20161129,robot lawyer will help those unable to afford legal fees
20161114,retiree face homelessness ahead of court ruling on park eviction
20160311,rockhampton waterways to be revitalised in flood mitigation plan
20160712,parmedics hopeful better pay offer will end dispute
20161114,donald trump says will accept fence parts of border
20160618,cats top of the tree after 57 point win over bulldogs
20160402,nrl live blog saturday round five
20161021,olive oil helps free student trapped for five hours in sa cave
20160513,drunk driver jailed over crash near mackay
20160414,woman found dead at traralgon home man taken to hospital
20160613,obama on the most deadly shooting in american
20161120,australian team announced for third test
20160920,pauline hanson maiden speech annotated
20160430,giants expose hawks' flaws in stunning 75 point win
20161010,no unsportsmanlike conduct in phillip hughes death: inquest
20161114,orange by election throws nsw nats into turmoil
20160516,artists and businesses call for local council to consider art
20160616,sailor dies on navy ship in middle east
20160930,the gentrification of sydneys chippendale in photos
20161115,trump causes uncertainty at climate change conference frydenberg
20160613,tasmanias suspended mining minister adam brooks resigns
20160320,global manufacturing in the spotlight in a quiet week
20160524,wa premier treasurer at odds over advertising
20160831,four metre cattle eating crocodile captured
20160122,four arrested as police make methamphetamine find in sydney
20160903,south china sea pentagon denies australia under pressure
20160702,euro 2016 wales beats belgium to set up semi final with portu
20161107,interview: kim beazley; former ambassador to the
20161111,aussie test team overworked says mitchell johnson
20160505,philip lowe announced as rbas next governor
20160307,abuse survivors urge prime minister to act on redress
20160504,gladstone unique aqua therapy service undergoes major change
20160215,warning on snake bites after 6yo girls death walgett
20161221,online charge back scam gutting small businesses
20160309,booyal students release kidding about for drought dvd
20160601,family dinners go viral as mum shares vietnamese food on social
20160827,nsw government urged to make sure childcare centres compliant
20160430,nissan recalls 3.8 million cars over faulty airbags
20160922,us celebrities criticise trump in video
20160304,google facebook unite behind apple iphone encryption fbi
20160113,mcdonald indias poor sporting record
20160715,women seek young sperm donors in defiance of evolutionary trend
20160201,supreme court chief justice trevor riley retires
20160617,prosecutors call for oliver curtis to receive a five year term
20160707,china rebukes un for criticising americans arbitary detention
20160903,tasmanian government releases gift register
20160227,waratahs start super rugby season with comfortable win over reds
20161026,australian dollar could be poised for significant drop
20161205,poetry enthusiast approaches century of recital
20160906,brad ness honoured to have been chosen paralympics flag bearer
20160815,closing the maths gap with story and dance
20160118,mick thomas on his new crowds
20160801,census 2016 why are people worried about the census
20160721,minerals and mining conference
20160822,mourners protest at turkey funeral for wedding
20161026,paid parental leave changes explained
20160315,mccann how the turkish president is burning down his own house
20160629,londoners rally against decision to leave eu
20160226,un voices fears over north korea russia extradition pact
20161104,bob day homestead creditors told grim news
20160810,manus island abuse claims by asylum seeker
20160920,bulldogs members buy more tickets than giants fans for afl final
20160510,one in 10 trucks on nsw roads defective; police say
20161005,sinkhole swallows car in adelaide on sunnyside road glen osmond
20160528,outrage in malaysia as government backs islamic law
20160401,penny arcade on the gay world that saved her life
20160427,arthur sinodinos says no to senate committee appearance
20160722,russian athletes doom and anger after cas appeal doping fails
20160401,afl boss satisfied with proactive measures concussion drugs
20160403,last children in mainland detention released into community
20160930,footage of exploding meteor discovered timber yard security cam
20160307,women erased from history on wikipedia
20160606,coalition and labor in tight race newspoll says
20160302,john howard protest vindictive suspension 730 three
20160203,lake macquarie locals on lead smelter claim discrimination
20160915,act election labor calvary hospital
20160729,hydro report finds cloudseeding had no effect on flooding
20160307,chinas economy growing at slowest rate in 25 years
20160105,chris gayle set to be sanctioned by melbourne renegades followi
20160126,food poisoning outbreak in sydneys south
20160627,brexit prompts rush to secure citizenship
20160523,drink if you dare introducing craft beer with essence of whale
20161215,artistry of australian coin designer stuart devlin on display
20161130,virtual shark detection clever buoy system test sydney aquarium
20161205,the carbon pricing debate explained
20160815,bolt and gatlin set up 100m final showdown
20160924,fly fishing weekend in wa aids recovery from breast cancer
20161214,us ambassador blasts assad regime; russia; iran at
20160606,east coast storm tasmania sees record flooding as wild weath
20160812,mike parr's 'extreme' exhibition opens national gallery
20160517,top ranked chinese official to listen to hk demands
20160416,six dead after horror night on victoria roads
20161021,new wheelchair gives the beach back to people with
20160606,east coast storm mapped
20160530,rye hunts family heads to rio
20161207,sausage party protesters storm aactas red carpet
20160323,queensland reds star liam gill committed to french move at end
20161201,nt bans restraint chairs in youth detention centres
20160818,adelaides csm steel goes into voluntary administration
