publish_date,headline_text
20160726,worker dies at central norseman gold mine
20160920,exposing bad medical science
20161123,national party faces existential threat from one nation polling
20160412,domestic violence perpetrators come forward gladstone
20160122,photographer captures stormy start to summer in desert
20160225,backpackers chosen over tasmanians for hospital project
20160920,tiahleigh palmer foster father charged with murder
20160429,lj hooker agents under investigation over missing client money
20160708,roel ten cate newspaper farewell editor parkes champion post
20160905,jasmine anderson recruited by adelaide crows
20160119,merge newcastle and port stephens councils
20160128,fatal crash in northern tasmania closes road
20160414,minor damage but no deaths in myanmar earthquake
20160414,thomas embling at crisis point over wait times court told
20161024,sally faulkner speaks to news breakfast
20160109,grantham floods timeline january 2011
20161006,next us president to face challenges as russia;
20160713,melbourne building light installation interprets weather
20161223,opposition calls for work for dole program to be overhauled
20161215,janet yellen says us economy to expand
20160107,rollout of queensland domestic violence courts delayed
20160210,burdekin pcyc 5 year fight for after school care
20160429,episode 14: veep; veep!
20161218,scientists dig up the dirt on northern australia
20160401,new operator of fitlink operations run by former owners sister
20160415,flying foxes
20160320,football final celebrates tiwi islands culture and future
20160112,building site evacuated after explosion in bondi
20161209,over 1000 russian athletes benefited from doping
20161204,california fire party warehouse was a death trap fears toll rise
20161106,birds of tokyo have 'something to say'
20161126,thunderstorm asthma claims fifth life in melbourne
20160803,rex blames downturn resources sector drop in passengers
20160124,brazils dilma rousseff backs corruption probe
20160824,interview: richard goyder; wesfarmers ceo
20160527,montague street bridge gets new safety measures
20160706,judge sentences oscar pistorius to six years jail
20160815,is david leyonhjelm trivialising discrimination
20160906,alcoa kwinana residential development appeal wattle road reject
20160314,darren britza murder trial jury discharged
20160615,orlando shooting comfort dogs helping people affected
20161114,shorten joyce visit gippsland post hazelwood
20160717,rabbit show jumping in perth
20160116,darwin vigil jakarta attacks
20160517,samatha farrer guilty of causing death by dangerous driving
20160919,men in japan attend classes to learn parenting
20161216,sewage fatbergs fat down sink face wipes quu
20160820,anti hiv drug truvada wont be listed on pbs as preventative
20160108,backpacker worker shortage putting strain on fruit harvesting
20160425,samoans counting the cost of cyclone amos
20160223,frm ballarat headmaster cannot remember sex abuse complaints
20161021,dagwood dogs fairy floss cotton candy rocky road challenge
20161209,new shark research investigate link to whale carcasses
20160626,paul gallen to seek out phil gould state of origin criticism
20160531,share market european stocks rise as wall st london closed
20160412,whitsundays residents banking on lenders temporary services
20160414,queensland has most cases of influenza queensland health
20160427,police probe gold coast unit fire at labrador
20160520,australias bmx riders are looking for redemption in rio
20160722,triple murderer ian jamieson sentenced to life in prison
20160425,history of png kiaps documented online
20160401,tough new rules for motorbike riders flagged for wa
20160121,russian airstrikes kill 1000 civilians activists say
20160927,mallee farmer restores wwii dc3 plane
20161004,india obsession with sons millions of lonely men after dowry
20161102,gold coast to lay own nbn cable for commonwealth games
20160921,wa frost damage worst in a decade
20160423,justice department drops efforts to unlock iphone
20160815,leyonhjelm makes human rights complaint over 18c white male
20160414,sydney football stadium refurbished instead of demolished
20160713,play school turns 50
20160708,inquest to be held into death of brothel madam shirley finn
20161219,government projects 2020 21 return to surplus
20161101,a poker machine maker accused of stacking the odds
20160419,strathalbyn mother fights to stop disabled daughter deportation
20160408,budget surplus predicted under 10m tas government says
20160813,yolngu hold makarrata ceremony with museum curators
20161129,child protection systems royal commission weatherill response
20160331,woman charged over alleged hit and run cyclist in ballarat
20160224,melissa chambers
20160618,melbourne storm winning streak ended by st george illawarra
20161011,juvenille detention royal commission prompts rally in sydney
20160203,world record largest crochet blanket donated to needy
20160818,nt leaders debate giles gunner head to head
20160715,west wyalong gold makes melbourne cup
20160721,ted cruz wife heidi escorted safety us republican convention
20160605,finance week ahead the rba meets while odds of a fed cut dive
20160108,man arrested after 60kg of ice intercepted
20160820,rio 2016 australian athletes fined 4000 each for accreditation
20160324,developer tower reminded to pay $250k rent for great keppel land
20160121,dalsanto germanys compassion moment is over
20161111,convicts come to life at hobart historic penitentiary
20161020,great barrier reef governments must spend more groups say
20160528,matildas face backlash after loss to boys team
20160307,burst water mains paradise campbelltown flooding newton
20160126,serena dumps sharapova out australian open in straight sets win
20160129,shane warne foundation closes amid controversy
20160214,a message from our friends
20160416,victoria announces another 57.6 million to tackle ice
20160704,black lung disease coal miner diagnosed with cwp
20160514,captains pick: bega roosters and chicks talk
20160710,election 2016 coalition frontbenchers confident of winning
20160712,scullion re elected as nationals senate leader
20160402,nick kyrgioss miami open run ends after semi final loss
20160603,asylum seekers wash up on libya beach as greece boat capsizes
20160907,royal adelaide hospital 39 bed closures suspended nurses say
20160124,wreckage found in thailand unlikely to be from mh370 experts say
20160628,israeli; turkish leaders laud deal to restore ties
20160101,two boats collide in sydney harbour
20161013,talking wigs and turbans
20160215,reducing isolation in older australians to improve wellbeing
20161030,carbon farming technology drilling carbon link
20160823,thor chris hemsworth wears livin hoodie in brisbane
20160812,elderly man charged over child sex offences in sa
20161020,matthew dellavedova tough label confuses fellow nba guard
20160928,former australia ambassador to china warns government of beijing
20161220,smog chokes china cities for fourth day
20160505,png pm loses attempt to delay anti corruption investigation
20160610,flood damage takes toll on national parks tourism
20160419,clive palmer commissions another audit into qld nickel refinery
20160901,why is it important to entertain our troops
20160325,lee bo missing hong kong bookseller back to china
20160119,concerned residents oppose water fluoridation in was north
20160906,sam dastyari and the south china sea quote causing trouble
20160916,west papauan band the black brothers make comeback
20160816,canberra man who stole $500k from tax office avoids jail time
20160321,crabb the turnbull of old returns with a dd showdown
20160119,body found in brunswick st shop after fire guts fitzroy building
20160604,paris floods stabilise as seine starts to recede
20161116,ruralco tasmanian operations general manager john tuskin
20160503,budget 2016 scott morrisons tax plan is a big con heres why
20160315,cigarettes could cost more under governments budget plans
20161213,naplan key takeaways from results
20161024,more female drone pilots needed in science and technology
20160217,ice in chocolates woman allegedly behind operation supreme court
20160705,wi fried
20160623,lightning kills at least 93 as monsoon sweeps india
20160701,election 2016 results game 12 things to watch
20160323,woodside abandons browse lng project kimberley coast
20160628,rural clownfish 270616
20160520,oldest bird band in australia found in south australia
20160814,rio 2016 cate campbell rues the greatest choke
20161020,wa labor to seek legal advice before axing roe 8 contract
20161107,us election voting explained using australian results
20160419,bunbury prisoner drug deterrent trial to go wa wide
20160419,what seats the parties will target in the election
20160518,syria refugee family resettle australia
20160531,dead mans parents to oppose any bid by fiance to use sperm
20160219,fuel ban to battle sniffing
20161109,us election trump thinks it's sad george w bush doesn't vote
20161020,oyster buyers worried for shortage
20160503,man goes missing from remote sa station
20160722,family law experts say family court needs overhaul
20161108,epas crash queen elizabeth hospital chaos for patients
20160303,claim cannabis stays in system for up to 12 hours questioned
20160916,intelligence linked mobile to bassam hamzy corrective services
20161201,marlo wild writes book about autistic son
20160331,moment police arrest man accused of stabbing couple
20160125,housing costs in australia second only to hong kong
20160718,toowoomba south lnp david janetzki claims victory in by election
20161005,retail sales figures up
20161101,ben maynard from grange resources
20160520,rural mental health funding nsw
20160331,fbi to assist belgium police investigate recent attacks
20161110,fornaroli has a league double against jets
20160815,sewer leak blamed after 60cm deep pothole forms in greenacres
20160227,anti racism group calls for peaceful protest in bendigo
20160203,inquest into port dennison murder suicide day three
20161227,pakistan australia second test mcg day two
20160125,ambulance bus for south australian emergencies launched
20161001,woman behind driving miss norma dies after year long road trip
20160915,irrigated agriculture now worth more than $15 billion
20160730,new claims of abuse at cleveland youth detention centre
20160607,man faces court accused of causing fatal attwood crash
20161020,murray goulburn milk price profit forecast down
20160427,senior police officer says sydney siege not a hollywood movie
20160808,drunkenness researcher calls for open review of vic licensing
20160603,roche gallery opens
20160204,george bailey claims david warner dismissal is not his fault in
20160204,a radical new proposal to prevent future zika
20160523,murrumbidgee irrigation area on cusp of golden period for growth
20161013,australias special forces alleged war crimes
20161020,auditor general in public spat with agency der environment
20160711,tiahleigh palmer death prompts protocol missing children
20160506,britax melbourne baby seat manufacturer to shut sunshine factory
20161120,queens baton unveiled 2018 commonwealth games
20160714,steven ciobo on ttp talk us may kill pact
20161215,cabinet minister hits out at union campaign on age pension
20160830,website logs national magpie attacks to help you stay safe
20160303,defence secretary rejects tony abbotts submarine attack
20160831,halep crushes flipkens at us open
20160222,port of melbourne to go ahead despite standoff government says
20160620,investigators examine damaged egyptair black boxes
20160624,wei li to be sentenced for possessing child pornography
20161117,man allegedly held against will at blair athol house
20161105,buildings destroyed by car wrecking fire in sydney's west
20161214,proper premier league: december 14
20161003,sa government energy policy exacerbated blackout greg hunt says
20160916,union calling for nsw transport minister to resign over bus fire
20161104,aec calls for more funding to improve polling system
20160330,crossbench senator says theres been no
20160702,election 2016 peter dutton holds dickson labor claims longman
20161205,aleppo girl bana alabeds twitter account disappears
20161202,jakarta protests against governor underway eight arrested
20161104,blame game starts in canberra over hazelwood
20160908,nrl match fixing eddie hayson investigation
20160919,coalition cracks down on illegal foreign owned property
20161110,doctors are too quick to prescribe drugs to dementia patients
20160306,islamic state is losing us envoy says
20160429,nsw producers reject calls to end mulesing in sheep
20160628,kidney disease in wa communities linked to nitrates in water su
20160112,tasmanian woodchip exports jump 76pc in 12 months
20160415,act politicians set for four per cent pay rise
20160412,union hopes victorian budget boosts western district police
20161010,survey logs how farmers are feeling
20160916,the challenges facing incoming rba governor
20161129,ellyse perry continues phenomenal batting form for southern sta
20161206,push for abattoir broken hill
20161207,western sydney school bucking downward trend in maths science
20160926,indian political cartoonist ajit ninan takes part in confluence
20161116,high court quashes convictions for adrian macdonalds murder
20160813,wa liberal party votes to remove words from discrimination act
20160323,bundaberg emu perfect match
20161029,prized icon wins victoria derby for james cummings
20160308,holmes matildas smash the football ceiling on road to rio
20161118,man jailed 10 years more than 2500 kgs cannabis trafficking
20160922,aboriginal mans death in custody remains a mystery
20160506,daughter of murdered madam shirley finn in plea for inquest
20160712,open mosque day enlightens north queensland community
20160726,al franken democratic senator goes after trump snl
20161028,revenge porn sexting penalties boosted in sa
20160923,turnbull talks cyber security; islamic state and
20160627,unicef 25 children reportedly killed in syria
20160923,abc open pic of the week
20160703,offsiders full program; sunday july 3
20160930,pilates giving confidence to 90 year old launceston woman
20160831,senate supports push for ms dhu footage release
20160710,couple arguing before man hit by car say police
20160428,kpca says idea of feedlotters forming cartel is silly
20161005,damselfish relocate adapt rising temps great barrier reef
20160106,emotional barack obama pushes for tighter gun rules
20160407,arrium enters voluntary administration
20160915,human remains found on mid north coast beach
20161129,queen beasts vase at parliament house
20160527,wa state solicitor warns bell group litigation will drag on
20160926,why mood is so important
20160610,maldives ex vp jailed for plotting to assassinate president
20160514,longreach sheep industry on cusp of change as wool prices up
20160621,cheerleaders encouraged to leave pom poms at home
20160118,francis dismisses parliamentary inquiry push yarloop fire
20160913,one in four australians have two or more chronic diseases
20160108,bendigo anti mosque protester named as one nation candidate
20160204,gst increase talk senior ministers play down backbench unrest
20161226,turkish authorities detained 1682 people last week
20160825,mylan epipen us prices hikes unlikely to happen in australia
20160821,nasa osiris rex asteroid probe set for september launch
20160727,inadequate tas regional services add to high medication rate
20160520,woman dies in brookvale after being hit by a truck
20160320,frightening alonso crash halts australian grand prix
20160203,david bowie mural artist jimmy c returns to adelaide
20160320,nsw jails private prison operators ohn morony windsor
20160527,a look back at week three of the election campaign
20161129,new rah inspected by the supreme court
20160224,voting begins in 2016 queensland local government election
20160801,png police say hostage situation was a hoax
20161006,skeletal remains at dilston in tasmania possibly identified
20161208,stolen images photographers fight back against online theft
20160127,snowzilla australian view from new york as big melt off begins
20160528,north queensland cowboys struggle against st george illawarra
20160323,abbott key to gaining conservative support indigenous referendum
20161118,man jumped from melbourne train into yarra river
20161215,asic wheat board executives sanctions iraq breach
20160831,rape trial former south adelaide footballer
20160511,major drug ring cracked in northern victoria police say
20160519,hawks to support roughead by getting back to normal clarkson
20160519,sailor feared missing off port stephens turns up safe
20161006,rain weather flood drought cocorahs network
20161214,scotsburn bushfire victims launch class action against neighbour
20160520,what mothers want in capricornia
20160506,mission to attract more women to australian army
20160716,wuthering heights kate bush fans gather in hobart for dance
20161021,france warns britain of tough time in brexit talks
20161117,act construction industry on notice after audit
20160319,syrian refugee sets sights on rio olympics turkey greece
20160229,canberra woman banned from owning animals for 10 years
20160624,families sa child protection backlog
20160922,chaos in charlotte as protests turn deadly
20160401,nrl cowboys house helping indigenous students
20160212,federal mp flatly denies labor pushing her out of seat
20161130,science maths test australia kazakhstan
20160801,prostate cancer testing bungle independent report
20160501,second man charged over murder of andrew carville
20160330,alleged gold coast knife bandit to front court
20161123,trawler geelong star leaves australia
20161111,albury city band celebrates 150th
20160212,friday rewind mount gambier man dances his way into world record
20160720,maths on melania trump speech
20161206,court challenge to victorian governments teen prisoner transfer
20160310,long approvals process sinks 2016 airlie aqua park plans
20160914,ukip's lisa duffy calls for more pressure on
20160212,launceston festivale fans face ticket price increase
20160711,eder goal gives portugal lead against france
20160118,16yo boy charged with drug trafficking in cunnamulla raids qld
20160203,horse owner cries foal play after wales mans selfie win
20161107,could senator rod culleton be on the way out
20160302,afp argue within law to seize cfmeu documents in raid
20160617,colac otway councillor code to restrict communication with media
20160219,hunter based yancoal miner seeks huge funds injection
20160701,expansion plan for freycinet national park revised
20161212,protestors arrested as roe 8 demonstion becomes heated
20161102,kevin rudd says asylum seeker laws sink to new lows
20160302,alan brown tributes trucking
20160331,most australian women still take husbands name after marriage
20160824,nsw greyhound industry determined to fight shut
20161005,yemens bank crisis raises new famine fears
20160718,from zimbabwe to newcastle the journey of a lawyer
20160129,essendon bombers sign former geelong cat mathew stokes for 2016
20161122,former wa premier richard court is new japan ambassador
20160822,sports funding what is the value of gold rio 2016 olympics
20161029,search underway for escaped prisoner in perth
20161202,are gut microbes involved with parkinsons disease
20160319,uk minister resigns over indefensible disability benefits cuts
20160607,teaching new drivers big picture could reduce road toll
20160317,motion for great keppel island casino licence defeated
20161128,south sudanese parents sending kids to africa to avoid crime
20160724,plebiscite only way to resolve same sex marriage george brandis
20160615,child psychiatrist charges over videos of boys in public toilets
20160408,karmichael hunt inspired to play for wallabies despite 'ok'
20160331,free range egg agreement reached
20161228,darwin man wayne morris completing 2016 hat challenge
20160803,ipswich sinkhole queensland government to cover costs
20160316,irans foreign minister criticises australias
20161005,port germein jetty damaged storm sa
20160907,wa protest laws on back burner till after election
20160912,labor promises new clinic for winnunga canberra
20160909,abc open pic of the week
20160104,joel paris set to make international debut after being named in
20160109,rey to be included in star wars monopoly
20160530,overwhelming support for pipeline from murray river
20160512,calls for death penalty for rapists in indonesia
20160421,ali elamine says outcome is for the best
20160903,philippines blast kills at least 14
20160113,lego brings back bulk orders after ai weiwei controversy
20161123,number grandparents caring children increases
20161024,year 12 exam anxiety
20160917,fancy bear has ties to russian presidency cyber expert says
20160421,battle of long tan survivor calls for greater support of veteran
20160523,full body scanner trial begins at canberra airport
20161005,yahoo secretly scanned customer emails for us intelligence sour
20160921,nigel scullion to face indigenous representatives
20161214,sara connor bali officers widow rejects compensation offer
20161013,monopoly australia edition remake
20160518,dutton warns illiterate refugees will take aussie jobs
20160614,gay hate preacher sheik farrokh sekaleshfar in sydney
20161110,adult colouring in helps women destress
20160219,manny pacquiao gay slurs boxing
20160302,pat dodson
20160112,coolamon attempted murder arrest
20161012,anti bikie police raid five properties in melbourne
20160106,stosur to undergo wrist scans
20160504,parramatta officials digging in for nrl fight over cap breaches
20161024,shark attacks man in surf off byron bay
20161011,victorian homes without power two days after gale force winds
20160204,vicroads move to ballarat still possible says labor
20160913,suns omeara nominates hawks for 2017
20160229,ceduna council calls for axing of two environment bodies
20160317,rethinking the flicks to make movies accessible and workable
20160201,powers jared polec ready to play after near career ending injury
20160826,nationals mps dumped after voting against greyhound racing ban
20160817,tree clearing rally outside queensland parliament debate
20161204,sunday december 4 full program
20160220,sexual fluidity label free life
20160610,health department boss admits under pressure to open water park
20160317,nrl cowboys v roosters 5 takeaways
20160406,melbourne city stumbling as a league race heats up
20161031,melbourne cup michelle payne's breeches bought by museum
20160627,second eu referendum brexit petition investigated for fraud
20160815,grandstand monday august 15
20160501,woman injured in bankstown shooting was an innocent bystander
20160401,fans embrace comic con perth
20160124,rosie batty australian of the year
20160913,andrew and michael greste chat with abc news
20161020,jimmy connors wants to coach nick kyrgios
20160209,which us presidential candidate has the best
20161117,government initiative to help veterans into civilian employment
20160829,common cold or serious illness biomarkers tell the difference
20160301,hobart traffic congestion police target bad behaviour
20160307,dozens facing charges over ufc brawl at hurstville in sydney
20160324,portland wind tower maker backs saving of arena; cefc
20160223,adelaides scrabble king shares two letter word tips
20160903,police search for two detainees escaped from canberras jail
20160109,big bash league: stars claim eight wicket win over renegades
20160728,clp imploding in wake of nt youth detention scandal
20160905,anao report identifies blackspots program weaknesses
20160209,sikh indian american actor waris ahluwalia barred from flight
20160727,boys club nt corrections to blame juvenile abuse four corners
20160610,parramatta eels brad arthur police salary cap
20160513,four legs in fashion why frenchies and dachshunds are on trend
20161010,kidman bid welcomed by pauline hanson ag industry
20160216,william tyrrells parents urge facebook public not to give up
20160318,reviews regulate share economy accommodation better than some m
20160919,nsw greyhound racing ban taskforce suggests 19000 dogs rehomed
20160226,perth wildcats illawarra hawks nbl semi final
20160108,orphans rejected by indonesian community for having hiv
20160217,tfs sandalwood expansion plan warnings not heeded by nt govt
20160607,thousands advised to evacuate as rise in northern tasmania
20161207,launceston man john millwood jailed over child sex charge
20160112,building site evacuated after explosion in bondi
20160428,un mediator finds some common ground at end of syrian talks
20160303,defence secretary rejects tony abbotts submarine attack
20160429,michelle barr in we will rock you
20161209,queensland anti fraud squad created significant fraud risk
20160123,man reported missing after swim found safe well
20160909,catastrophic loss of wilderness on planet earth
20161005,builder in a panic when he burnt down dane swans pub court told
20160906,rodrigo duterte regrets son of a whore comments at barack obama
20160517,duncan storrar thanks australia for support after qanda
20160718,organ donation and road safety message are legacy
20160830,convict tattoos tasmanias inked history explored in book
20161215,residents in dark over raaf base contamination clean up
20160524,report into cfa fiskville training facility tabled in parliament
20160705,licensee speaks out about premier hotel fire in albany
20160716,new lease on life gerhard infante three months on surgery
20160809,anz profit slides in third quarter trading update
