publish_date,headline_text
20161014,jim maxwell hopes to be back for new years test
20160508,turnbull calls july 2 election
20160525,election 2016 barnaby joyce fitzgibbon di natale goulburn debate
20161209,solomon islands struck by earthquake; tsunami warning issued
20161107,clinton tells rally love trumps hate
20160115,alan rickman quiz
20161002,rspca tasmania fighting for investigative funding
20160511,discovery girl magazine slammed for swimsuit tips article
20161102,solo kayaker arrives on australian soil ending 23000km paddle
20160920,uber driver charged over passenger assault
20160708,community anger after flinders island council boss sacking
20160419,abcc bill will trigger double dissolution election
20160930,the giant sized headache for germany's largest bank
20160501,asylum seeker boat sinks off libya
20160405,everlast latest artist to tell trump to stop using song
20160520,paris attacks suspect arrives in france for questioning
20161206,shanshan ai beijing to hobart for art life change
20160419,asic registry sale no threat to traralgon jobs says mp
20160104,joel paris set to make international debut after being named in
20160921,maroochydore rubbish revolution envac underground
20160225,perth police keen on smaller booze buses
20160223,tasmanias energy crisis explained
20160211,iron boy reports for duty at nsw police hq
20160210,property boom generates profit rise for building firms
20160318,safe schools protestors trash senators office
20160223,rob carlton was not to adrienne ferreiras taste
20160603,dunlop australias own trump
20160922,domestic violence safe house to open in regional sa
20160719,indonesian police hoping militant killed in fire fight santoso
20161017,png captain assad vala leads from the front as
20160221,cyclone winston fiji death toll rises to six
20161013,brexit; trump not concerns in henderson janus
20161112,png hosts worldwide women under 20 fifa event
20161214,loxton christmas tree festival celebrates 20 years
20160721,reward doubles police seek information bill roach
20160930,pledge to open new children's hospital before end of year
20161117,construction starts on new kandanga hotel
20160614,golden state warriors drop nba finals game five to cleveland
20160315,ashley higgins lnp tennyson resigns explicit photos allegations
20160919,rio ferdinand tweet sparks food fight over nasi goreng origin
20160911,eating disorders fuelled by anti obesity message: support group
20160716,philippines rodrigo duterte meets with alleged drug lord
20160521,egyptair flight ms804 debris photos released smoke on board
20160901,uncertainty over nrl salary cap stopping players from re signing
20161116,interview: cesar melhem; victorian labor mp
20160915,motion to spilt queensland into two states defeated parliament
20161017,irish rugby in shock as munster coach foley dies
20160826,man dramatic coma recovery ultrasound treatment on brain ucla
20160602,election 2016 malcolm turnbull bill shorten on sydney origin
20160530,outback upbringing no barrier for 17yo nobel prize hopeful
20160604,muhammad ali greatest quotes
20160728,australian shares end higher
20160922,woman charged with murder of drug cook and girlfriend
20160406,princess margaret childrens hospital staff to be cut
20160526,dr anne garnett debunks foreign investment myths
20161104,brenton dickson is attacked by supporters of the
20160914,unions cast doubt government claims child protection caseloads
20160420,rodney clavell accomplice jailed for violent robbery
20160802,kilauea volcano smiley face captured by helicopter company
20160805,gorman accused of copying independent designers work
20160124,shane warne charity to submit audit of books consumer affairs
20160111,sky trains for melbournes east under consideration
20160527,vote compass sunday pay penalty rates
20160124,hundreds rally for great keppel island development
20160215,heartbroken chinese elephant crushes cars on valentines
20160326,man charged with murder after body found in old mine
20160218,stranded dolphin released after stranding bruny island
20160619,foster care system set for 560 million funding boost
20160914,suspected cocaine discovered greeting cards brisbane
20160706,roger saunders teaching aboriginal art across australia
20161208,new parramatta stadium plans unveiled by nsw government
20161125,josh hazlewood australia messed up david warner timing
20160118,nsw paramedics busy stingers
20160602,rural action movement greg kenney facing legal action
20160528,around 14000 migrants rescued off boats in last week; un says
20160804,domestice violence leading to homelessness in central australia
20160325,fish frenzy on good friday
20160814,nauru abuse allegations require senate inquiry says bill shorten
20161214,aleppo evacuation delayed as rebels blame iran
20161121,search for yowies yetis leads to discovery of lazarus species
20160923,us senator elizabeth warren berates wells fargo john stumpf
20160520,what mothers want in capricornia
20161227,man dies from coastal taipan bite yorkeys knob cairns queensland
20161025,tap dancing grandmother says age no barrier hobby
20160518,aoc boss unsure if australians among positive beijing tests
20160915,rodrigo duterte ordered 1000 murders; hitman claims
20161007,pound slump
20161009,christopher pyne staffer jack walker resigns stripping scandal
20161101,star casino should not be exempt from sydney lockout laws mp say
20160727,bernie sanders supporters take over democrat media centre
20160417,truck drivers take to canberra roads to protest pay rates
20160925,when life gives you melons youre dyslexic
20160617,fairfax election grill
20161205,john key speaks after announcing his resignation
20160614,two sumptuous goals see italy beat belgium 2 0
20160514,lloyd the hero as tigers beat swans after the siren
20161012,canal oyster gardens restore native reefs
20160920,strawberries beneficial insects drone
20160218,vet eats his breakfast with dog graycie
20160512,consumer advocate presents 87 thermomix burns
20161006,richard roxburgh on cleaver greene failure and writing kids book
20160602,veteran accused of assaulting rspca staff committed to trial
20160408,an attempted abduction of children from beirut
20160324,indigenous tourism europe
20160314,bishop says high commissioner in contact with journalists
20160224,russell st bomber takes legal action to complete counselling
20161006,australia hasnt learned us car industry lessons
20160902,no extra jail time for man who threatened builder with fake gun
20160502,nsw parliamentarian andrew gee wins nationals preselection
20160320,wa biodiversity bill full of loopholes says wwf
20160212,senior clp figures urging willem westra van holthe to quit
20161107,rockhampton teenager seriously injured eye magpie attack
20161031,acquitted boyfriend breaks silence in matthew leveson inquest
20160916,arrests made; ice seized in queanbeyan
20161005,defective brakes on truck that crashed at dee why
20161111,yarloop primary school will reopen next year after backflip
20160810,beenleigh stabbings mcdonalds carjackings near brisbane
20160710,election 2016 turnbull shorten back electronic voting
20160721,graham sculpture new face of tac victorian road safety campaign
20161111,yarloop primary school will reopen next year after backflip
20160717,fire damages cars and house in woodville west
20160724,russian adventurer plans next adventure
20161201,politics live december 1
20160710,wa weather cold july winter hits perth south west
20160120,gunning grassfire burning near isolated properties
20160923,real life fault in our stars wife dies
20160829,army unveils latest gadgets and gear
20160611,muslims forced to worship in underground mosque in athens
20160922,sydney teenager's leg broken in alleged muck up day assault
20160921,truck rollover in melbourne causes peak hour delays
20160827,new trump manager faced domestic violence charge: report
20160118,perth scorchers paceman andrew tye twenty20 call up
20160908,rodrigo duterte was directing comment at reporters not obama
20161112,archbishop christopher prowse regrets healing service absence
20160715,2016 archibald prize finalists
20160716,chaos in taksim square as jets buzz crowd and
20160123,murray beats sousa as father in law hit by medical drama
20160308,essential water makes unions an offer
20160721,dillian nason png frogs
20160607,election 2016 abc visits shepparton for country hour broadcast
20161014,former hunter priest vincent ryan sentenced for sex abuse
20160927,how light atoms work together to build quantum gate
20160427,police review cctv in hunt for banksia grove gunman
20160911,bushfire codes hampering rebuilding efforts on great ocean road
20160705,obama photographer pete souzas best pictures
20160327,papua new guinieans suffering amid food shortage
20160329,tick saliva sheds light on blood and immune disorder treatments
20160117,you are doing vitally important work: turnbull
20160325,russia and us agree to speed up syria peace effort
20160104,new south wales teenager reported missing in brisbane
20160919,kevin tabotta resignation not linked to poor rio haul; ca says
20161108,thunderstorm warning issued south east queensland
20160229,abc politics blog february 29
20161121,tasmanian aboriginal people angry heritage law changes delayed
20160607,storms aftermath and tree damage whose responsibility is it
20160822,rio 2016 olympic games top quotes
20160912,market slump 40 billion wipe out
20160309,bega choir from churches and bush halls to carnegie hall
20161215,png deploys military to protect gas project stop tribal fighting
20160909,clive palmer gives evidence to qld nickel hearing brisbane
20160509,philippines election day largely peaceful with few killed
20161019,hobarts prince of wales theatre history
20161229,sa primary industries count the cost of unseasonal
20161108,drug could prevent many pre term births: adelaide uni research
20160105,matthew scutter glides into win at world championships
20161122,down syndrome parents pressured to terminate pregnancy
20160615,jericho politicians beware when full time work begins to slip
20160524,investigators raid googles paris hq over tax case: prosecutors
20160107,parkes elvis festival priscilla takes centre stage
20160730,paraglider hospitalised after crashing into cliff
20160726,une researcher saves dinosaurs with laser beam technology
20161227,alzheimers and dementia patients benefit from memorywell
20160828,brisbane apartment slowdown will be too late to stop price fall
20160719,louise bell murder trial defence closing
20161014,outlaw motorcycle gang member killed at start of tasmanian tour
20160720,motor neurone disease sufferer hopeful cure will be found
20160324,portland wind tower maker backs saving of arena; cefc
20160407,gucci ad banned for showing unhealthily thin model
20161114,marmion announces merging traffic solutions
20160521,doubts cast on indigenous australians referendum
20160415,barnaby joyce launches australias first cannabis farm
20160907,it's official australia's 25 years without a
20160613,nsw police commissioner andrew scipione recognised
20160929,football allardyce admits judgement error in england farce
20160128,fiskville former fire chief denies railroading family into offer
20160101,odonovan defiant over brutal a league headbutt
20161221,blame game for berlin christmas market attack begins
20161027,warren mundine rips into indigenous imprisonment inquiry
20160708,greyhound rescuers expecting influx of dogs to rehome
20160907,chalkers hill winery winning over international fans
20160525,twitter changes what you need to know
20160406,global executions up 50 per cent in 2015 amnesty
20160605,wild weather thrashes nsw; stranding drivers and
20160723,allardyce gets england job at second time of asking
20161219,india's plan to step away from coal casts doubt on adani mine
20160317,headline: the drum thursday march 17
20160317,brendon wyatt drug case dismissed lloyd rayney district court wa
20160420,young children sexually assaulted taken from day care
20160929,man pleads guilty to attacking truck driver with hammer in wa
20160510,whitsunday artists rebuild confidence following gallery fire
20161007,low risk female prisoner missing in adelaide
20160330,teen charged sexual assault woman brisbane bar
20160617,figures reveal latrobe crime spike
20160201,wollongong ballet company debuts with nutcracker
20160922,indigenous rangers share to help fight straddie bushfires
20160504,chinese nationals taken into custody from geraldton boat
20160802,sportsbet hits out at sa governments online betting tax
20161213,a man tried to fight me he won
20160111,renegades keep bbl finals hopes alive with win over thunder
20160526,clive palmer turns liberal wrecking ball
20161102,kalbarri one punch attack victim critical in perth hospital
20161117,ab de villiers remains the skipper say proteas
20160911,amber alert police find toddler 16yo townsville
20160930,lancefield fire final report brings changes
20160624,rockhamptons sporting siblings follow in parents big footsteps
20160407,beagle puppies stolen by fake rspca officers
20160119,ato phone scam warning in canberra with victims losing $100k
20160927,mount bold spills
20160508,prisoners caught breaking back in to darwin jail
20161027,leading scientists on state of climate 2016
20161008,weakening but still powerful matthew plows up atlantic coast
20160527,man pleads guilty to road rage incident involving baseball bat
20161220,horror of berlin attack to have ramifications for angela merkel
20161009,former wa sheep station becomes conservation reserve
20160826,trump labels racist tag tired argument
20160724,police seek man over gold coast shooting
20160628,berg perverse small target strategies leave voters guessing
20161123,aria awards 2016 flume crowded house
20160928,the drum wednesday september 27
20160111,csu wagga wagga not being downgraded
20160301,forestry tasmania fails to gain fsc certification
20160929,mat dear ord irrigation excavator
20160810,what is a ddos attack
20161110,westconnex changes mean winners in camperdown losers in newtown
20161128,government workers sent home after water aircon cut city office
20160323,look back at the events of the brussels attacks
20160930,former prisoners bake jam drops for school children
20160209,asx australian shares fall in early trade
20161005,bird added to list of species under threat by pipeline
20160629,cctv footage shows people fleeing turkey airport blast
20160606,woman killed in shark attack
20161124,meriton faces legal action over masking tripadvisor claims
20160912,labor promises new clinic for winnunga canberra
20160607,turnbulls speech slap in the face to rsl members
20160216,grammy quiz
20160925,bulldogs take down giants
20160705,mining considered on land bought by qld government
20161128,john newcombe backs nick kyrgios bernard tomic omission
20161209,wikipedia edit a thon tackles internet gender gap
20161209,us astronaut john glenn dies at age 95
20161021,crash landing feared as europes mars lander still silent
20160908,ngo questions need to acquire permits to hold
20161129,chance of a lifetime beckons for 'son of samoa'
20160702,deadly shooting in serbian cafe
20160331,qas seeks palm island indigenous cadets
20160710,election 2016 malcolm turnbull claims election victory
20160616,nicholls proposes alternative job creation program budget reply
20160404,harvey dam blackwood river fertile breeding ground for marron
20160818,elaine thompson wins 200m usain bolt wins semi final
20160704,police display seizure of 275kg of crystal meth
20161022,act election final tally has labor 12 liberals 11 greens 2
20161123,three crown casino staff formally arrested in china
20160727,queensland macaw free flight videos go sky high on social media
20160816,anna meares speaks after ending her rio olympics campaign
20160405,breaking the bystander effect and saving lives
20160930,officials to inspect health of dairy cows
20160815,milked dry promo
20160203,benalla council confident about rate cap compliance
20160818,george newton vietnam veteran letter changed his life
20161111,flinders gambling centre under threat
20160201,terror suspects feet to be compared to those in is flag photo
20160304,sunshine coast fijian man helping village
20160617,wade graham handling of suspension shows how much he has matured
20160906,trump clinton court ohio as white house race heats up
20160530,stockbroker and anz bank stoush
20160921,northbourne avenue new look plan unveiled by canberra liberals
20161219,rod culleton two men evicted former one nation senator court
20160210,skorea to suspend operations at joint industrial park
20160720,trump tells the republicans he is so proud to be their nominee
20160504,optus releases premier league pricing fans react
20160603,flood warning for gippsland as heavy rain forecast
20160518,longer sentence sex offender eamon sumner who bashed 70yo woman
20160508,quolls released back into flinders ranges
20161014,archbishop philip wilson loses court appeal
20160808,international paralympic committee suspends russia over doping
20160507,sam stosur nick kyrgios out of madrid masters
20160928,family plead for footage of ms dhus final moments released
20160615,orlando shooting survivors tell stories of horror
20160531,aircraft noise under adelaide airport flight path on agenda
20160523,election 2016 politicians expense claim system to be reviewed
20160720,melbourne wholesale market flower growers concerned over profits
20160128,axe murderer william mitchell should stay in jail colin barnett
20160410,phillip island to keep motor sports events until 2027
20161215,curtis powell death shannon fentiman says low risk case
20160107,vanuatu election candidate confusion kicks off campaigning
20160822,droughtmaster tops fitzroy crossing bull sale 2016
20160908,livestock exporters prepare for busy religious festival
20160609,no bicycle zone for footpaths in millicent and penola
20161012,millers point sirius residents last days
20160825,crash victims family breaks down in newcastle court
20161207,native flower market blooming as farmer takes eucalypts to world
20160219,more families turning to home education in canberra
20160704,matthewson turnbull is a leader besieged on all sides
20161210,canberra female firefighters more than double with new recruits
20161118,australian at scene of schneider murder
20160610,why is there a wood duck living in my tree
20160324,australia institute forestry report
20161221,berlin market attack rocks locals sense of security
20160905,five people injured including elderly woman in dog attack
20160219,malcolm turnbull plays down chances of nz taking refugees
20160420,energy minister fails to say if aware of basslink outage concern
20160725,tiger selfies exposed report by world animal protection
20160824,olympic experience start of good things ahead for
20160215,extinction fears for south west was hibernating fish
20160106,brisbane medical trial testing personalised melanoma treatment
20160225,broken hill council confirms library rumours
20160114,jeff kennett robert doyle at odds over safe injecting rooms
20160712,eels blame former ceo for salary cap breaches
20161006,energy industry; consumer groups tell governments
20160922,oceania football confederation set to have a
20160329,easter egg hunt descends into chaos after parents take over
20160205,chinese new year at buddhist temple for year of monkey
20160312,gold coast council karaoke asian investors
20160430,islamic museum promotes positive values to engage young muslims
20160802,paralympic track and field team named in canberra
20160731,fans gear up for firebirds v swifts netball grand final
20160229,two bikies plead guilty over role in belconnen mall brawl
20160828,miss faafafine samoan transgender beauty pageant
20160725,helpmann awards 2016 guide
20161110,dairy farmer wins sa local hero 2017
20160222,south australian cricket at the cross roads ahead of blues clash
20160824,illegal workers detained on woolgoolga blueberry farm
20161005,us vice presidential contenders blast trump clinton
20160705,wet weather on the way for victorias east
20160406,light rail the anchor for newcastle cbd development
20161004,indonesians 'in love' with south korea
20160109,japanese zentai craze dress lycra full body suit escape
20160222,bendy bus stuck in the middle of road sparks traffic chaos
20161125,disability pension review could trigger stress: sa government
20160213,three treated for serious injuries after two car crash near lit
20160920,chickpea crop threatened by rain
20160513,intellectually disabled deaf man found unfit to stand trial
20161214,sydney weather heat december record bondi beach penrith
20160118,pakistan court acquits pervez musharraf of rebel leader killing
20161102,nrn updating animal welfare
20160525,security footage shows ballarat sergeant putting
20161121,justin timberlake on trolls failure becoming more evolved artist
20160524,bendigo councillors to vote on mall crime crackdown
20160608,darwin festival 2016 to go ahead administrator confirms
20160708,two men rescued from car roof in gippsland floodwaters
20160604,heavy rain and possible flooding forecast in victorias east
20160201,senator glenn lazarus troubled by clive palmer refinery woes
20160418,afl concerned about concussion numbers
20160807,eagles claim derby honours over freo as kennedy bags seven
20160601,shooters and fishers mp robert borsak says he ate
20161210,prison playground equipment installed for visiting children
20160613,murray bridge rowing legacy celebrated
20161119,katich; mcgain bemoan fast tracked youth in australian cricket
20160606,novak djokovic calendar grand slam rod laver wishes him luck
20160609,resources downturn creates new opportunities for wa start ups
20160203,takeaway coffee cups piling up in landfill
20160413,youth homelessness matters day 2016
20160617,juliette obrien
20160708,sa budget older workers need more support lobby group says
20161008,trading solar power: retirees 'plan for the future'
20161006,police officer chris hurley upset during assault hearing
20160915,man sentenced to jail over attack on pensioner
20160817,black market weapons thieves channel guns to bikies
20161021,mount gambier show in decades gone by
20160420,brussels bombings suspect osama krayem also charged over paris
20160921,pedestrian hit by car at greenwith
20161019,chuck berry celebrates 90th birthday with new album announcement
20160930,figures reveal australias stillbirth rate is about five per day
20160921,singapore airlines flight arrives in canberra
20160304,organic farmers invite public to day on the farm
20161003,sa severe weather warning cancelled rain falls across adelaide
20160912,nairo quintana wins vuelta a espana to gain revenge over tour d
20160308,denmark business chamber demands bridge details
20161114,malcolm turnbull united states refugee resettlement
20160104,faulty powerlines could spark another marysville fire
20160922,snakes give definite signs about their mood says expert
20160919,tasmanian minister orders asbestos audit after school incident
20160811,solomon islands out to defy the odds at fifa
20160107,di natale breaks greens policy on genetically modified crops
20160727,victoria police investigating george pell over abuse complaints
20160126,the evolution of australia day
20160709,dallas shooting videos show how deadly attack on police officers
20160505,way clear for donald trump as john kasich drops out
20161229,police confident they've dismantled drug ring
20160506,canadian authorities plan to airlift residents wildfire spread
20160212,kulture break dance mentor program helping canberra young people
20160527,amber galloway gallego signs hilltop hoods
20160425,mexican government undermined students deaths probe panel says
20160926,cape conran boat ramp debacle
20160920,three cornered election contest leaves kalgoorlie wide open
20160723,solar plant to store power in shipping container sized batteries
20160115,yarloop residents renew call for town to be moved
20160203,trooper donaldson was deprived of sleep;
20160801,paralympic swimmers ready to take on big games in rio
20160106,un peacekeepers hit by new child sexual abuse claims
20160825,wa premier colin barnett slams polling showing election loss
20161113,ca chief sutherland backs under fire australian skipper smith
20161108,mcculkin murder trial garry dubois seen at mcculkins house
20160921,png government applies to dismiss manus island compensation bid
20160105,brian schmidt takes the reins at anu
20160128,nambucca council considers seeking compensation for wrc road da
20160704,lachlan smart bid youngest person fly around globe
20160520,josh dugan injury not serious state of origin
20160226,man apologises for flying drone over hunter fire
20161015,airlines ban samsung galaxy note 7 on flights
20160504,emmanuel congolese refugee career
20161114,troy grant considering position following orange byelection
20160728,csu becomes first in australia to be carbon neutral
20160511,sa federal parties to remove premature election posters
20160224,two plead not guilty to murder of perth man wade cameron dunn
20160905,grandstand monday september 5
20160831,morning markets wall street falls on apple
20160722,taste rarely rates when it comes to superfoods: adelaide study
20160508,cassidy election 2016: turnbull must study hawkes 1984 campaign
20160121,asx share market rises in morning trade
20160624,saca signs deal to grow the game of cricket in shandong
20160311,boil water alert continues for cardwell kennedy amid e coli find
